reviews,cleaned_review,sentiment,sentiment_category,categories
"✅ Trip Verified |  Have not flown economy with BA for years, what a shock! Hard uncomfortable seats, small aged tv screens with limited inflight entertainment. Food and service appalling. 13hr plus flight, no socks, eye shades, ear plug amenity pack. And no antibacterial wipes offered. Wi-Fi advertised but not available on flight. Paid premium money for a budget airline, more akin to Easy Jet, RyanAir or JetStar. My last time travelling with BA after more than 18 years of flying with them. BA you really do need to buck up your service and become the flagship Service you used to be.",   have not flown economy with ba for years what a shock hard uncomfortable seats small aged tv screens with limited inflight entertainment food and service appalling hr plus flight no socks eye shades ear plug amenity pack and no antibacterial wipes offered wifi advertised but not available on flight paid premium money for a budget airline more akin to easy jet ryanair or jetstar my last time travelling with ba after more than  years of flying with them ba you really do need to buck up your service and become the flagship service you used to be,-0.010813492063492075,Negative,"['Facilities', 'Staffing Levels', 'Specific Service Issues']"
"✅ Trip Verified |  British Airways is getting worse an worse, my flight was 8 mins late. Luggage is taking hours to arrive.  No communication whatsoever from anyone. They can't be reached on the phone and answer with delays to emails, if they do. My app is crashing most of the times. They change the aircraft without notice, so even if you pay for a seat, the staff will say there is nothing they can do.",   british airways is getting worse an worse my flight was  mins late luggage is taking hours to arrive  no communication whatsoever from anyone they cant be reached on the phone and answer with delays to emails if they do my app is crashing most of the times they change the aircraft without notice so even if you pay for a seat the staff will say there is nothing they can do,-0.12000000000000002,Negative,"['Customer Service', 'Facilities', 'Specific Service Issues']"
✅ Trip Verified | Paid for 3 business class seats to London from New York. Got downgraded at airport check in because they overbooked business class. Couldn’t even provide compensation or a refund. Told I had to call customer service or submit a form. Unbelievable. Unacceptable. Never again. ,  paid for  business class seats to london from new york got downgraded at airport check in because they overbooked business class couldn’t even provide compensation or a refund told i had to call customer service or submit a form unbelievable unacceptable never again ,-0.05681818181818182,Negative,"['Customer Service', 'Facilities', 'Specific Service Issues']"
"✅ Trip Verified |  British Airways continues to go downhill. We flew business class and the experience was like economy from 20 years ago except you can have a glass of champagne. We were packed in full 3x3 seats because of IT issue the day before. Even if weren’t, the Seat pitch and width is the same as economy. Gone are the little pretend tables in the middle seat to give some illusion of style. The food was dreadful. The in flight service was unsophisticated. BA used to have an acceptable European business class. They don’t any more. Other European airlines offer much better in flight experience in business class in comparison. BA is taking premium and frequent flyers for granted and treating us like mugs. How I miss the politeness of old BA business class from around 5 years ago, how I used to look forward to it, the small gestures like hanging up a coat, giving you a hot towel, having nice food, being served from the galley, rather than from the manky trolley. COVID is not the reason - this is years of cost cutting and the result is dreadful.",   british airways continues to go downhill we flew business class and the experience was like economy from  years ago except you can have a glass of champagne we were packed in full x seats because of it issue the day before even if weren’t the seat pitch and width is the same as economy gone are the little pretend tables in the middle seat to give some illusion of style the food was dreadful the in flight service was unsophisticated ba used to have an acceptable european business class they don’t any more other european airlines offer much better in flight experience in business class in comparison ba is taking premium and frequent flyers for granted and treating us like mugs how i miss the politeness of old ba business class from around  years ago how i used to look forward to it the small gestures like hanging up a coat giving you a hot towel having nice food being served from the galley rather than from the manky trolley covid is not the reason  this is years of cost cutting and the result is dreadful,-0.04236111111111111,Negative,"['Facilities', 'Staffing Levels', 'Specific Service Issues']"
"✅ Trip Verified |  I have flown with BA for many years and today was another poor experience as I’ve witnessed the airline decline into a sub-par service. I understand that it’s been a tough two years for airlines but BA’s decline started before the pandemic and it has now truly plummeted. Enormous queues at JFK BA check-in terminal 7. Even the priority lane was at a standstill for at least half an hour before people started complaining they’d miss their flights. Terrible efficiency at the check-in counters. At times, only one member of staff is processing people whilst other BA staff stood around on their phones or having a chat. One member of staff stopped processing a man desperately trying to catch his flight in order to start processing someone else who had jumped in. The interior of the plane was generally filthy, crumbs, bits of food, stains, marks all around the seating area. They give you a single wet wipe which I used to think was for your hands but now I see most passengers wiping down their surrounding area. There are some very good and courteous members of staff but there are also some awful members of staff who behave unprofessionally. On this particular flight one of the cabin crew is as swearing about his colleague at the back of the plane who apparently wasn’t pulling his weight. Very poor. I used to be a proud BA flyer but now I just feel like I’m clinging on to my airline status which doesn’t actually provide you a better service these days.",   i have flown with ba for many years and today was another poor experience as i’ve witnessed the airline decline into a subpar service i understand that it’s been a tough two years for airlines but ba’s decline started before the pandemic and it has now truly plummeted enormous queues at jfk ba checkin terminal  even the priority lane was at a standstill for at least half an hour before people started complaining they’d miss their flights terrible efficiency at the checkin counters at times only one member of staff is processing people whilst other ba staff stood around on their phones or having a chat one member of staff stopped processing a man desperately trying to catch his flight in order to start processing someone else who had jumped in the interior of the plane was generally filthy crumbs bits of food stains marks all around the seating area they give you a single wet wipe which i used to think was for your hands but now i see most passengers wiping down their surrounding area there are some very good and courteous members of staff but there are also some awful members of staff who behave unprofessionally on this particular flight one of the cabin crew is as swearing about his colleague at the back of the plane who apparently wasn’t pulling his weight very poor i used to be a proud ba flyer but now i just feel like i’m clinging on to my airline status which doesn’t actually provide you a better service these days,-0.06403492063492067,Negative,"['Customer Service', 'Facilities', 'Staffing Levels', 'Specific Service Issues']"
"✅ Trip Verified |  The entertainment selection was sub par, minimal selections and the new releases were  not new releases. My food left something to be desired. Two of the seats in our row the earphone jack didn’t work. The plane was either uncomfortably hot or too cold, find a medium temp. Just overall a very basic generic airline.",   the entertainment selection was sub par minimal selections and the new releases were  not new releases my food left something to be desired two of the seats in our row the earphone jack didn’t work the plane was either uncomfortably hot or too cold find a medium temp just overall a very basic generic airline,-0.04242424242424243,Negative,"['Facilities', 'Staffing Levels']"
"✅ Trip Verified |  Extremely disappointed In trip experience. I am Gold MVP 100,000+ miler with Alaska Airlines. My ticket and travel wasnt linked with Alaska Airlines. When speaking with Alaska representative, they confirmed it was due to lack of effort on British Airways In accomplishing this task. I could over look the lack of effort on this even though frustrating. The Main issue is the ticketing and Flt connection process.  I departed Egypt this morning with connecting tickets in hand. Once I arrived in USA apparently my Alaska (AS 2449) flt was changed to a 5 hour later flight with a completely different airline (Delta). Who does that without notifying the customer. I found this out when trying to go through security In Seattle, they said my ticket was not valid. I had to go to Alaska Airline to find out What the issue was. They explained British Airways had rebooked with Delta. This took about 30mins with customer Service. Then i had to go to Delta to sort the mess out. I am so frustrated.",   extremely disappointed in trip experience i am gold mvp  miler with alaska airlines my ticket and travel wasnt linked with alaska airlines when speaking with alaska representative they confirmed it was due to lack of effort on british airways in accomplishing this task i could over look the lack of effort on this even though frustrating the main issue is the ticketing and flt connection process  i departed egypt this morning with connecting tickets in hand once i arrived in usa apparently my alaska as  flt was changed to a  hour later flight with a completely different airline delta who does that without notifying the customer i found this out when trying to go through security in seattle they said my ticket was not valid i had to go to alaska airline to find out what the issue was they explained british airways had rebooked with delta this took about mins with customer service then i had to go to delta to sort the mess out i am so frustrated,-0.12777777777777777,Negative,"['Customer Service', 'Facilities', 'Staffing Levels', 'Specific Service Issues']"
"Not Verified |  Check-in very slow. No app check-in and could not check my vaccine QR code online. Check in staff friendly but too few of them. BA Silver card holder and no Stockholm lounge  to use. Boarding fine, but plane was worn out. Seats close together and row 30 even worse.  Crew really professional and happy it seemed. Arrival at Heathrow a total shambles. BA777 landed at 12.50, no gate so waited and waited for 25 minutes. Then BA jetty didn’t work. Then BA had no steps. Very slow to leave plane as only moderately mobile wheelchair passengers struggle down the steps. Everyone was very patient and supportive but it was terrible to watch. So BA skimping on lounge, plane condition and gate. Crew good, seats very uncomfortable.",   checkin very slow no app checkin and could not check my vaccine qr code online check in staff friendly but too few of them ba silver card holder and no stockholm lounge  to use boarding fine but plane was worn out seats close together and row  even worse  crew really professional and happy it seemed arrival at heathrow a total shambles ba landed at  no gate so waited and waited for  minutes then ba jetty didn’t work then ba had no steps very slow to leave plane as only moderately mobile wheelchair passengers struggle down the steps everyone was very patient and supportive but it was terrible to watch so ba skimping on lounge plane condition and gate crew good seats very uncomfortable,-0.005522875816993472,Negative,"['Customer Service', 'Facilities', 'Staffing Levels']"
"✅ Trip Verified |  After 1h queuing at the check-in desk, I am told that my booked seat is not available. Why do you sell seats that you do not have?",   after h queuing at the checkin desk i am told that my booked seat is not available why do you sell seats that you do not have,-0.2,Negative,['Facilities']
"Not Verified |  Outbound, seated in row 10, I was told they had run out of my chosen food option (shepherd's pie), so I had to settle for gnocchi. The steward had the temerity to blame the food supplier - as if BA could not get a better one! On the return, boarding from the back, not by priority, then, seated in row 12, I had the last half glass of champagne (only because one of the other passengers in row 12 had declined). Food was rigatoni with vegetables. Overall, penny pinching by BA in club class. Dreadful - not for us again.",   outbound seated in row  i was told they had run out of my chosen food option shepherds pie so i had to settle for gnocchi the steward had the temerity to blame the food supplier  as if ba could not get a better one on the return boarding from the back not by priority then seated in row  i had the last half glass of champagne only because one of the other passengers in row  had declined food was rigatoni with vegetables overall penny pinching by ba in club class dreadful  not for us again,-0.09895833333333333,Negative,"['Facilities', 'Staffing Levels']"
"✅ Trip Verified | 3 hours standing in line for boarding pass. Airline would not allow me to obtain boarding pass electronically. Then they said the flight was overbooked so my adult daughter got bumped from the flight. And yes, we used VeriFLY. My flight is now delayed for at least 30 minutes. They are so unorganized and slow! Getting a seat in advanced is not performed like other airlines. You have to wait even though I paid for it. Avoid this airline at all costs! Absolute worst!",   hours standing in line for boarding pass airline would not allow me to obtain boarding pass electronically then they said the flight was overbooked so my adult daughter got bumped from the flight and yes we used verifly my flight is now delayed for at least  minutes they are so unorganized and slow getting a seat in advanced is not performed like other airlines you have to wait even though i paid for it avoid this airline at all costs absolute worst,-0.1464285714285714,Negative,"['Facilities', 'Staffing Levels']"
"Not Verified |  I booked and paid for what I thought was a business class seat on a flight to Athens. What I got was a premium economy seat. The first nine rows were business class seats, rows 10 to 16 were what should have been the premium economy cabin (but had been added to the business class section) which had less comfortable seats that didn’t fully recline, unlike the seats in rows 1 to 9 (I was in row 11). This is not a case of me being snobby, but simply a point of principle and a clear case of BA mis-selling. Had I known prior that I would be paying the same business class price but for seats that were less comfortable than other business class passengers on the same flight, I wouldn’t have booked. I complained on board along with several other passengers who also resented being scammed in that way. I also made a formal complaint to BA but was fobbed off. Apparently this is a long running scam, I don’t know how they get away with it.",   i booked and paid for what i thought was a business class seat on a flight to athens what i got was a premium economy seat the first nine rows were business class seats rows  to  were what should have been the premium economy cabin but had been added to the business class section which had less comfortable seats that didn’t fully recline unlike the seats in rows  to  i was in row  this is not a case of me being snobby but simply a point of principle and a clear case of ba misselling had i known prior that i would be paying the same business class price but for seats that were less comfortable than other business class passengers on the same flight i wouldn’t have booked i complained on board along with several other passengers who also resented being scammed in that way i also made a formal complaint to ba but was fobbed off apparently this is a long running scam i don’t know how they get away with it,-0.0019607843137254832,Negative,"['Facilities', 'Staffing Levels']"
"✅ Trip Verified | This was my first flight during the pandemic, so it was understandable the difficulties facing airlines. Check-in was longer than normal due to the vaccine checks and passenger locator forms etc. But on the return flight, it was a total mess. Just two counters open for economy and one for business. There were arguments regarding vaccine checks, where two BA staff were contradicting each other. It took an hour and ten minutes just to check in, resulting in the flight delay. On board, I was not expecting great service.  Seating was extremely uncomfortable, 29 inch pitch and 17 inch wide seats - just about bearable for an hour and a half flight.  On board service was a packet of crisps and a small bottle of water from another, no eye contact with me just handed out. However, I was pleased that disembarking passengers were let out in groups, despite a few idiots who decided to stand a up to get their hand luggage out while the aircraft is was still taxing to the gate. The cabin crew did manage to force them back to their seats and close the lockers.",  this was my first flight during the pandemic so it was understandable the difficulties facing airlines checkin was longer than normal due to the vaccine checks and passenger locator forms etc but on the return flight it was a total mess just two counters open for economy and one for business there were arguments regarding vaccine checks where two ba staff were contradicting each other it took an hour and ten minutes just to check in resulting in the flight delay on board i was not expecting great service  seating was extremely uncomfortable  inch pitch and  inch wide seats  just about bearable for an hour and a half flight  on board service was a packet of crisps and a small bottle of water from another no eye contact with me just handed out however i was pleased that disembarking passengers were let out in groups despite a few idiots who decided to stand a up to get their hand luggage out while the aircraft is was still taxing to the gate the cabin crew did manage to force them back to their seats and close the lockers,-0.043627450980392155,Negative,"['Customer Service', 'Facilities', 'Staffing Levels', 'Specific Service Issues']"
"✅ Trip Verified |  I usually avoid BA because of its appalling customer service and sneaky extra charges, but this flight was my only option. Note that BA actually charges for seat pre-selection in biz class -- 100 UK pounds in this case! Does any other airline in the world dare do that? I saved the money and waited until checkin to choose my seat for free. The seats were BA's universally derided, cramped 6-across back-to-front configuration, where you stare into the face of your seat mate an arm's length away. No other airline ever came up with this awkward arrangement --- I wonder why? No preflight drink was offered. At meal time I selected one of the three main offerings, only to be told it wasn't available -- even though there were only 3 people in my 16 seat biz section. The seat area has practically no storage except a tiny drawer at ankle level that is inaccessible when the seat is in lie flat position. The ""bed"" is the narrowest I have experienced in biz class, and is also very hard. The cabin was very cold and the blanket very thin; I had to raid blankets from two other seats just to stay warm. The amenity kit is the smallest I've ever seen in biz class -- it fits in the palm of the hand. All in all, this uncomfortable, miserly experience is hardly worth the £5,727 that BA charges for this route. I used miles to pay for my ticket -- but of course got whacked with BA's unique and notorious ""fuel surcharge"" fee of $636 for using miles.",   i usually avoid ba because of its appalling customer service and sneaky extra charges but this flight was my only option note that ba actually charges for seat preselection in biz class   uk pounds in this case does any other airline in the world dare do that i saved the money and waited until checkin to choose my seat for free the seats were bas universally derided cramped across backtofront configuration where you stare into the face of your seat mate an arms length away no other airline ever came up with this awkward arrangement  i wonder why no preflight drink was offered at meal time i selected one of the three main offerings only to be told it wasnt available  even though there were only  people in my  seat biz section the seat area has practically no storage except a tiny drawer at ankle level that is inaccessible when the seat is in lie flat position the bed is the narrowest i have experienced in biz class and is also very hard the cabin was very cold and the blanket very thin i had to raid blankets from two other seats just to stay warm the amenity kit is the smallest ive ever seen in biz class  it fits in the palm of the hand all in all this uncomfortable miserly experience is hardly worth the £ that ba charges for this route i used miles to pay for my ticket  but of course got whacked with bas unique and notorious fuel surcharge fee of  for using miles,-0.022000000000000002,Negative,"['Customer Service', 'Facilities', 'Staffing Levels', 'Specific Service Issues']"
"✅ Trip Verified |  Lower Deck Club Class seat, with the current awful, narrow business class facing seats. British Airways premium passengers are treated with indifference at best, and Club Class is simply terrible. My food was not fit for consumption. WIFI broken. Crew morale low. IFE quality a bad joke. To add insult to injury, the  amenity packs are contemptible. What makes BA management think that business people require, (or indeed would retain) a package of socks, mask, plastic pen, and disposable tooth brush? The ongoing decline of this once-great national airline is palpable. ",   lower deck club class seat with the current awful narrow business class facing seats british airways premium passengers are treated with indifference at best and club class is simply terrible my food was not fit for consumption wifi broken crew morale low ife quality a bad joke to add insult to injury the  amenity packs are contemptible what makes ba management think that business people require or indeed would retain a package of socks mask plastic pen and disposable tooth brush the ongoing decline of this oncegreat national airline is palpable ,-0.22727272727272724,Negative,"['Facilities', 'Staffing Levels']"
"✅ Trip Verified |  London to New York JFK. Another grim flight with British Airways in Club Class, on a tired and old B747-400. The Business Class at BA is by far the worst in the industry. The dreaded ying / yang configuration is going to be with us for some time, sadly. In flight entertainment with tiny screen, no HD, and poor movie selection. WIFI did not work, as usual. Food continues to be desperately poor, and crew were rather keen to disappear quickly. This airline needs major overhaul, and investment in new aircraft and seats.",   london to new york jfk another grim flight with british airways in club class on a tired and old b the business class at ba is by far the worst in the industry the dreaded ying  yang configuration is going to be with us for some time sadly in flight entertainment with tiny screen no hd and poor movie selection wifi did not work as usual food continues to be desperately poor and crew were rather keen to disappear quickly this airline needs major overhaul and investment in new aircraft and seats,-0.2054292929292929,Negative,"['Facilities', 'Staffing Levels']"
"Not Verified |  Gatwick to Malaga. Nothing special, nowadays there's unfortunately not much difference between BA & Easyjet. Flight left Gatwick late & arrived in Malaga late. BA seats no longer recline. Food and drinks are expensive, their Cream Tea excludes tea. Lift your game BA, your product just continues to get worse.",   gatwick to malaga nothing special nowadays theres unfortunately not much difference between ba  easyjet flight left gatwick late  arrived in malaga late ba seats no longer recline food and drinks are expensive their cream tea excludes tea lift your game ba your product just continues to get worse,-0.20535714285714285,Negative,"['Facilities', 'Staffing Levels']"
"✅ Trip Verified |  London to Cape Town. Gone are the days in which British Airways was a great airline. Weird seat configuration, service that needs training, horrible food and no internet in business class are  basic services offered by most of the airlines but not by BA.",   london to cape town gone are the days in which british airways was a great airline weird seat configuration service that needs training horrible food and no internet in business class are  basic services offered by most of the airlines but not by ba,-0.033333333333333326,Negative,"['Facilities', 'Staffing Levels', 'Technology', 'Specific Service Issues']"
