reviews,cleaned_review,sentiment,sentiment_category,categories
"✅ Trip Verified | Probably the worst business class experience I've ever had on an airline. Just a few of the issues: Required to purchase seats on international (Club World) business class. This was not made known during the ticket purchase process and cost me an additional $600 on a single leg (LHR-LAX) for a family of four. Given the very strange business class seating layout on BA A380s, leaving the seat selection to change could have been disastrous for my family. Ridiculously long boarding times on even small aircraft. On my VIE-LHR leg, the boarding time for the A320 was over 50 minutes long, leading to a delayed departure. There was no urgency on the part of staff to speed up the boarding times. Severe overcrowding in the boarding area in satellite C of terminal 5 at Heathrow. Boarding staff would not allow passengers to enter the roped off queue area before boarding (I have no idea why not) and so crowding was extreme. The overall boarding area was far too small for an A380, and I believe this satellite was designed and built after the first A380s were delivered. Online check-in in advance of flights appears to be completely broken. I was urged repeatedly (on the BA website, and via email and text) to ""upload my COVID documents"" even though, at the end of 2022, there are no COVID documents required for travel. After I filled in basic contact information on the website - and did not upload any ""COVID documentation"" - I was informed (several hours later) that my ""COVID documents have been verified"". I then received another text message urging me to ""upload my COVID documentation"". On the VIE-LHR leg, the shop.ba.com page that one is directed to after attempting to connect to wifi on the plane indicated ridiculously incorrect remaining flight times - over six hours, and then four hours just before landing. BA lounges for Club Europe and Club World at Heathrow are often seriously overcrowded. Furniture and carpeting and other finishes in the clubs are worn or dirty. That said, the food in the lounges was of pretty good quality. The food quality in BA lounges at Heathrow may be the only redeeming thing about this airline. Onboard, food and beverage service was far below average for international business class. Terrible, one might say. On the LHR-LAX leg, there was no pre-meal beverage service and there were NO mid-flight beverage services at all. Unlike most business class offerings on other airlines, there was no taking a meal order by flight attendants at the beginning of the flight. Meals were brought out haphazardly shortly after take off, with the ""chicken or fish?"" type of meal selection similar to economy class. There was no coffee or tea service after meals. Food quality was poor, with the pre-landing snack of a ""ploughman's lunch"" being downright disgusting. . There was no beverage or bar set-up in the galley areas - beverages available to passengers during the flight - as is standard on most international business class offerings. Even bottles of water seemed be hidden away, requiring one to ask the flight attendants for water. I won't comment on the bizarre seating layout on the A380, as others have rightly panned the awkwardness and extremely poor design of the seating. The seats are not 6' 2"" long as stated on the BA website, and I found the seats too short for my 6' 2"" height. The ""Priority"" luggage tags were not followed in the baggage delivery.",  probably the worst business class experience ive ever had on an airline just a few of the issues required to purchase seats on international club world business class this was not made known during the ticket purchase process and cost me an additional  on a single leg lhrlax for a family of four given the very strange business class seating layout on ba as leaving the seat selection to change could have been disastrous for my family ridiculously long boarding times on even small aircraft on my vielhr leg the boarding time for the a was over  minutes long leading to a delayed departure there was no urgency on the part of staff to speed up the boarding times severe overcrowding in the boarding area in satellite c of terminal  at heathrow boarding staff would not allow passengers to enter the roped off queue area before boarding i have no idea why not and so crowding was extreme the overall boarding area was far too small for an a and i believe this satellite was designed and built after the first as were delivered online checkin in advance of flights appears to be completely broken i was urged repeatedly on the ba website and via email and text to upload my covid documents even though at the end of  there are no covid documents required for travel after i filled in basic contact information on the website  and did not upload any covid documentation  i was informed several hours later that my covid documents have been verified i then received another text message urging me to upload my covid documentation on the vielhr leg the shopbacom page that one is directed to after attempting to connect to wifi on the plane indicated ridiculously incorrect remaining flight times  over six hours and then four hours just before landing ba lounges for club europe and club world at heathrow are often seriously overcrowded furniture and carpeting and other finishes in the clubs are worn or dirty that said the food in the lounges was of pretty good quality the food quality in ba lounges at heathrow may be the only redeeming thing about this airline onboard food and beverage service was far below average for international business class terrible one might say on the lhrlax leg there was no premeal beverage service and there were no midflight beverage services at all unlike most business class offerings on other airlines there was no taking a meal order by flight attendants at the beginning of the flight meals were brought out haphazardly shortly after take off with the chicken or fish type of meal selection similar to economy class there was no coffee or tea service after meals food quality was poor with the prelanding snack of a ploughmans lunch being downright disgusting  there was no beverage or bar setup in the galley areas  beverages available to passengers during the flight  as is standard on most international business class offerings even bottles of water seemed be hidden away requiring one to ask the flight attendants for water i wont comment on the bizarre seating layout on the a as others have rightly panned the awkwardness and extremely poor design of the seating the seats are not   long as stated on the ba website and i found the seats too short for my   height the priority luggage tags were not followed in the baggage delivery,-0.08300099206349205,Negative,"['Customer Service', 'Facilities', 'Staffing Levels', 'Specific Service Issues']"
"✅ Trip Verified | Definitely not recommended, especially for business class. The seats are ridiculous and small, the food is mediocre if that, and good luck with the internet even if you pay for full internet for the entire flight. The service however has been great. My attendant saved me from crying. I don’t know who designed this aircraft but in this expensive business class, in order to move out of you middle seat to go to the bathroom you must rudely climb over the person’s legs sitting in the aisle seat. Your seat is like an enclosed tiny cubicle with no storage space. I’ve unfortunately traveled British Airways business class at least 4 times within the last 4 months. Never again unless there is no other choice. By the way, the business class lounge south at Heathrow is a cattle pen.",  definitely not recommended especially for business class the seats are ridiculous and small the food is mediocre if that and good luck with the internet even if you pay for full internet for the entire flight the service however has been great my attendant saved me from crying i don’t know who designed this aircraft but in this expensive business class in order to move out of you middle seat to go to the bathroom you must rudely climb over the person’s legs sitting in the aisle seat your seat is like an enclosed tiny cubicle with no storage space i’ve unfortunately traveled british airways business class at least  times within the last  months never again unless there is no other choice by the way the business class lounge south at heathrow is a cattle pen,-0.03854166666666666,Negative,"['Customer Service', 'Facilities', 'Technology', 'Specific Service Issues']"
"Not Verified |  When will BA update their Business class cabin - 8 across on a 777. It is not so much travelling facing backwards as it were, but the cabin staff having to pass food trays across the front of passengers paying business class fares! As for having to pay to reserve a specific seat - an antiquated idea. The cabin staff were fine, food acceptable, check-in OK and Business lounge (breakfast) acceptable. The lack of space in the seating area, small screen and disfunctional entertainment equipment disappointing. Having to step over the reclining passengers feet is not attractive. ",   when will ba update their business class cabin   across on a  it is not so much travelling facing backwards as it were but the cabin staff having to pass food trays across the front of passengers paying business class fares as for having to pay to reserve a specific seat  an antiquated idea the cabin staff were fine food acceptable checkin ok and business lounge breakfast acceptable the lack of space in the seating area small screen and disfunctional entertainment equipment disappointing having to step over the reclining passengers feet is not attractive ,-0.019047619047619042,Negative,"['Customer Service', 'Facilities']"
"Not Verified |  BA cancelled my flight home, the last flight of the day into Heathrow, and tried to push me onto another flight to London City 3 hours later! My car was at Heathrow. I didn't want to try and cross London late at night on public transport with luggage, especially as there were rail strikes announced around that time. I had to book a flight home with Lufthansa which cost €500 for an economy seat, but at least it got me home to Heathrow (all be it another terminal) on the Friday night so I could get home to family. I still have had no news on a refund of the €500 2 months on. It's such a shame, flying BA used to be such a pleasurable experience. BA have cancelled or moved one leg of every journey we've booked this year. We are regrettably have to use other airlines now which have much better reliability and customer service.",   ba cancelled my flight home the last flight of the day into heathrow and tried to push me onto another flight to london city  hours later my car was at heathrow i didnt want to try and cross london late at night on public transport with luggage especially as there were rail strikes announced around that time i had to book a flight home with lufthansa which cost € for an economy seat but at least it got me home to heathrow all be it another terminal on the friday night so i could get home to family i still have had no news on a refund of the €  months on its such a shame flying ba used to be such a pleasurable experience ba have cancelled or moved one leg of every journey weve booked this year we are regrettably have to use other airlines now which have much better reliability and customer service,-0.02045454545454545,Negative,"['Customer Service', 'Facilities', 'Staffing Levels', 'Specific Service Issues']"
"✅ Trip Verified |  Stupidly tried BA again after a five year gap and paid over £7000 for my wife and I to go to Barbados because I thought the new Business Class layout might rival Virgin Atlantic on the route. About six months ago BA announced they were switching planes to the old antique push-me-pull-you layout but it was too late to reorganise our holiday logistics. Sure enough we suffered the most appallingly uncomfortable flights with no room (eight seats across), worn out fittings, inedible food and surly FAs.",   stupidly tried ba again after a five year gap and paid over £ for my wife and i to go to barbados because i thought the new business class layout might rival virgin atlantic on the route about six months ago ba announced they were switching planes to the old antique pushmepullyou layout but it was too late to reorganise our holiday logistics sure enough we suffered the most appallingly uncomfortable flights with no room eight seats across worn out fittings inedible food and surly fas,-0.04545454545454544,Negative,['Facilities']
"✅ Trip Verified |  Disappointing again especially on business. The service is ancient, one world lounges are a catastrophe at Heathrow. Business class seat is similar to economy and electronics are very poor onboard. ",   disappointing again especially on business the service is ancient one world lounges are a catastrophe at heathrow business class seat is similar to economy and electronics are very poor onboard ,-0.28,Negative,"['Facilities', 'Specific Service Issues']"
"✅ Trip Verified |  I was flying to Warsaw for one day of meetings and would be flying back out to Miami the next day. Initially my flight was delayed in Denver by 3 hours. As such I knew I would miss my connection in Warsaw. The Denver to Heathrow flight was terrible. The plane was dirty, I was in economy, I usually fly business or Premium Economy but on this flight there was no availability. The plane was only about 2/3 full and the service was not good. My food was inedible and the seats very cramped although the middle seat was open so that made it tolerable. When i arrived in Heathrow it was a complete circus. Passengers everywhere trying to rebook missed connections. Not only my flight but multiple other flights had missed connections. After waiting in line for an hour I was finally rebooked on another BA flight to Warsaw. This plane was the smallest 3x3 plane I have seen. Packed in like sardines. My bag never showed up so i had to cancel my meeting and now have no bag to fly back to Miami. BA has shown no desire to help other than to give me standard answers and that hopefully my bag will show up in Miami at some point and I can retrieve it from there. I mean the bag is sitting in Heathrow somewhere with 6 different fight options to get it to Warsaw yet BA in unwilling to do anything to expedite getting my bag to Warsaw before I leave for Miami the next day. ",   i was flying to warsaw for one day of meetings and would be flying back out to miami the next day initially my flight was delayed in denver by  hours as such i knew i would miss my connection in warsaw the denver to heathrow flight was terrible the plane was dirty i was in economy i usually fly business or premium economy but on this flight there was no availability the plane was only about  full and the service was not good my food was inedible and the seats very cramped although the middle seat was open so that made it tolerable when i arrived in heathrow it was a complete circus passengers everywhere trying to rebook missed connections not only my flight but multiple other flights had missed connections after waiting in line for an hour i was finally rebooked on another ba flight to warsaw this plane was the smallest x plane i have seen packed in like sardines my bag never showed up so i had to cancel my meeting and now have no bag to fly back to miami ba has shown no desire to help other than to give me standard answers and that hopefully my bag will show up in miami at some point and i can retrieve it from there i mean the bag is sitting in heathrow somewhere with  different fight options to get it to warsaw yet ba in unwilling to do anything to expedite getting my bag to warsaw before i leave for miami the next day ,-0.010500000000000002,Negative,"['Facilities', 'Staffing Levels', 'Specific Service Issues']"
"✅ Trip Verified | Extremely sub-par service. Highlights: No online meal selection. Staff pretty much dropped off whatever meal they had and were very rude if a passenger wanted it changed. Last meal was delayed to the last 40 minutes of flight. Plates were literally grabbed away. I had to hand over my unfinished plate that the staff again dropped on me. No apology. No offer of a napkin. I had to scrounge for a piece of paper to clean my jacket. None of the passengers were told to straighten up their seats before meal. Because the seat before me was so tilted, I could barely keep the plate on the tray without things slipping off. Staff walked down with some water and biscuits. This got exhausted just before she got to me. She just looked at me and walked away. Nothing further was offered.",  extremely subpar service highlights no online meal selection staff pretty much dropped off whatever meal they had and were very rude if a passenger wanted it changed last meal was delayed to the last  minutes of flight plates were literally grabbed away i had to hand over my unfinished plate that the staff again dropped on me no apology no offer of a napkin i had to scrounge for a piece of paper to clean my jacket none of the passengers were told to straighten up their seats before meal because the seat before me was so tilted i could barely keep the plate on the tray without things slipping off staff walked down with some water and biscuits this got exhausted just before she got to me she just looked at me and walked away nothing further was offered,-0.025324074074074072,Negative,"['Customer Service', 'Facilities', 'Staffing Levels', 'Specific Service Issues']"
✅ Trip Verified | Flew from Amman to London on Nov. 14 2022. Not sure what type of aircraft it was. My Ticket was economy plus. The flight is 5h35m. We received exactly 250ml of water and about 10 potato chips. The seats did not recline and there was no entertainment system. Any other food or drink had to be purchased. So we couldn't even get a warm cup of coffee or teas. It is the third time I have flown with BA recently and was unhappy each time but did not write a review. Will honestly never fly them again if I can help it.,  flew from amman to london on nov   not sure what type of aircraft it was my ticket was economy plus the flight is hm we received exactly ml of water and about  potato chips the seats did not recline and there was no entertainment system any other food or drink had to be purchased so we couldnt even get a warm cup of coffee or teas it is the third time i have flown with ba recently and was unhappy each time but did not write a review will honestly never fly them again if i can help it,-0.065625,Negative,"['Facilities', 'Staffing Levels']"
"Not Verified | Worst experience ever. Outbound flight was cancelled and I was not notified. I was rebooked on a very uncomfortable trip. Inbound flight delayed 1 hour, also not notified. On top of it, they boarded my hand luggage, which was the only bag I had. Extra wait in Milan then. Food is horrible.",  worst experience ever outbound flight was cancelled and i was not notified i was rebooked on a very uncomfortable trip inbound flight delayed  hour also not notified on top of it they boarded my hand luggage which was the only bag i had extra wait in milan then food is horrible,-0.35833333333333334,Negative,"['Facilities', 'Specific Service Issues']"
"✅ Trip Verified |  Check in was a shambles at BWI, just 3 counters open for a very full flight. The bag drop queue was even longer than the regular check-in queue! Boarding was done by zones so that was carried out reasonably well. Once on board, the FAs were fine, not as engaging on my outbound flight to IAD. The aircraft was cramped and the seats in economy were horrible. I was seated in an aisle seat (row F) where there is an entertainment box taking up a third of your legroom. Overall, very cramped seat, poor legroom and awful IFE screens. The meal was mediocre and there was no bar service before the meal this time. On lading, we were served a hot sandwich which had oozing cheese all over the wrapper so it was not pleasant to handle but tasted very good! The plane landed at a remote stand which meant that we had to be bussed to T5 and since it was raining, it was not a nice experience. Overall, I rate this just as a mediocre journey.",   check in was a shambles at bwi just  counters open for a very full flight the bag drop queue was even longer than the regular checkin queue boarding was done by zones so that was carried out reasonably well once on board the fas were fine not as engaging on my outbound flight to iad the aircraft was cramped and the seats in economy were horrible i was seated in an aisle seat row f where there is an entertainment box taking up a third of your legroom overall very cramped seat poor legroom and awful ife screens the meal was mediocre and there was no bar service before the meal this time on lading we were served a hot sandwich which had oozing cheese all over the wrapper so it was not pleasant to handle but tasted very good the plane landed at a remote stand which meant that we had to be bussed to t and since it was raining it was not a nice experience overall i rate this just as a mediocre journey,-0.06675,Negative,"['Facilities', 'Staffing Levels', 'Specific Service Issues']"
✅ Trip Verified |  London to Gibraltar on 25th October 2022. I booked my flight several months ahead of travel and was rather disappointed by the experience.  BA attempt to nickle and dime the customers with outrageous seat selection prices. Offering of a very small bottle of water and a nutribar as a breakfast and one gains the impression of where BA aim to be positioned at of late. The A320 has was no inflight entertainment or a route map. The staff disappeared for most of the flight. The flight was punctual but I felt cheated and under whelmed by the experience. ,   london to gibraltar on th october  i booked my flight several months ahead of travel and was rather disappointed by the experience  ba attempt to nickle and dime the customers with outrageous seat selection prices offering of a very small bottle of water and a nutribar as a breakfast and one gains the impression of where ba aim to be positioned at of late the a has was no inflight entertainment or a route map the staff disappeared for most of the flight the flight was punctual but i felt cheated and under whelmed by the experience ,-0.3125,Negative,"['Customer Service', 'Facilities', 'Signage and Navigation']"
